{
  "schema_version": "1.0",
  "call_id": "demo-call-001",
  "turn_index": 13,
  "scores": {
    "neutral_default": 0.2549,
    "objection_raising": 0.0523,
    "time_pressed": 0.6929
  },
  "best_persona_id": "time_pressed",
  "confidence": 0.6929,
  "calibrated": false,
  "abstained": false,
  "reason": "time_pressed 0.69 >= 0.6",
  "evidence": [
    {
      "feature": "rush_rate",
      "value": 0.3333,
      "detail": "+0.00 scale units off the time_pressed prototype"
    }
  ],
  "uncertain_signals": [
    "question_rate"
  ],
  "scorer": "prototype",
  "model_version": "prototype:objection_raising@1.0.0,time_pressed@1.0.0",
  "latency_ms": 0.036
}
